{
  "schema_version": "1.0.0",
  "repository": "wfprieto/World-Class-SEO-Agent-System",
  "state": "READY",
  "accountable_role": "Repository maintainer",
  "destination": {
    "type": "EMAIL",
    "public_instructions": "mailto:wfprieto@gmail.com"
  },
  "owner_authorized_publication": true,
  "repository_controlled": false,
  "distinct_from_security_intake": true,
  "monitoring": {
    "status": "VERIFIED",
    "monitor_role": "Repository maintainer",
    "attested_at": "2026-10-29T12:00:00-04:00",
    "attestation_ref": "gmail-profile-sha256:cffaef28ce43210066ebf9dbbe3f5922091a22c253d7035c423a7c7dedd43395"
  },
  "access_test": {
    "status": "PASS",
    "tested_at": "2026-10-29T12:00:00-04:00",
    "method": "Authenticated Gmail profile lookup via connected provider; no mailbox contents accessed"
  },
  "acknowledgement_target_hours": 72,
  "activation_requirements": {
    "status": "PROVIDER_VERIFIED",
    "required_disclosures": [
      "acknowledgement target",
      "monitoring role",
      "confidentiality limits",
      "conflict handling"
    ],
    "prohibited_evidence": [
      "repository issue comments",
      "repository commits",
      "self-authored assertions",
      "example or test destinations"
    ]
  },
  "review_due": "2027-01-31",
  "rollback_rule": "Remove invalid public instructions, set this contract and linked governance controls to BLOCKED_OWNER_ACTION, and preserve no report contents in repository evidence.",
  "prohibited_repository_data": [
    "credentials",
    "mailbox contents",
    "reporter identity",
    "report contents",
    "private access URLs"
  ]
}
